{
  "meeting_date": "2025-08-21",
  "committee": "常任委員会",
  "title": "文教児童委員会 資料（令和7年8月21日）",
  "page_url": "https://example.local/itabashi/minutes/2025-08-21-bunkyo",
  "pdf_url": "https://example.local/itabashi/minutes/sample.pdf",
  "crawled_at": "2025-08-26T08:49:00Z",
  "meeting_type": "委員会",
  "metadata": {
    "total_pages": 3
  }
}